{"clip_id": "SYNTHETIC01_62-70", "camera": "B", "audio_stripped": true, "prompt_version": "facts_v2", "model": "fixture", "runs": 3,
 "facts": [
  {"obs": "OBS-02", "value": "gap", "agree": "3/3", "source": "pose", "strokes": "5/5"},
  {"obs": "OBS-05", "value": "several", "agree": "3/3", "source": "model", "strokes": "5/5"},
  {"obs": "OBS-21", "value": "bent", "agree": "3/3", "source": "model", "strokes": "5/5"}
 ]}
