{
 "clip_id": "2Nn9tyMECZU_94-124",
 "camera": "B",
 "audio_stripped": true,
 "prompt_version": "facts_v3",
 "model": "gemini-3.8-flash",
 "runs": 3,
 "facts": [
  {
   "obs": "OBS-01",
   "value": "clearly_bent",
   "agree": "2/3",
   "source": "model",
   "strokes": "12/18"
  },
  {
   "obs": "OBS-02",
   "value": "visible_gap",
   "agree": "3/3",
   "source": "model",
   "strokes": "18/18"
  },
  {
   "obs": "OBS-03",
   "value": "ahead_of_front_hip",
   "agree": "3/3",
   "source": "model",
   "strokes": "18/18"
  },
  {
   "obs": "OBS-04",
   "value": "no_pause",
   "agree": "2/3",
   "source": "model",
   "strokes": "12/18"
  },
  {
   "obs": "OBS-05",
   "value": "few_adjust_steps",
   "agree": "3/3",
   "source": "model",
   "strokes": "18/18"
  },
  {
   "obs": "OBS-06",
   "value": "semi_open",
   "agree": "3/3",
   "source": "model",
   "strokes": "18/18"
  },
  {
   "obs": "OBS-07",
   "value": "a:reaches_across_body_front",
   "agree": "2/3",
   "source": "model",
   "strokes": "12/18"
  },
  {
   "obs": "OBS-08",
   "value": "clearly_sideways",
   "agree": "3/3",
   "source": "model",
   "strokes": "18/18"
  },
  {
   "obs": "OBS-09",
   "value": "square_or_past",
   "agree": "2/3",
   "source": "model",
   "strokes": "12/18"
  },
  {
   "obs": "OBS-10",
   "value": "a:heel_up_at_contact",
   "agree": "3/3",
   "source": "model",
   "strokes": "18/18"
  },
  {
   "obs": "OBS-11",
   "value": "down_then_forward_and_up",
   "agree": "3/3",
   "source": "model",
   "strokes": "18/18"
  },
  {
   "obs": "OBS-12",
   "value": "unclear",
   "agree": "0/3",
   "source": "model",
   "strokes": "0/18"
  },
  {
   "obs": "OBS-13",
   "value": "a:weight_on_front_foot",
   "agree": "2/3",
   "source": "model",
   "strokes": "12/18"
  },
  {
   "obs": "OBS-14",
   "value": "lean_unchanged",
   "agree": "2/3",
   "source": "model",
   "strokes": "12/18"
  },
  {
   "obs": "OBS-15",
   "value": "a:finish_above_non_hitting_shoulder",
   "agree": "3/3",
   "source": "model",
   "strokes": "18/18"
  },
  {
   "obs": "OBS-16",
   "value": "good",
   "agree": "3/3",
   "source": "model",
   "strokes": "18/18"
  },
  {
   "obs": "OBS-17",
   "value": "pointing_up",
   "agree": "3/3",
   "source": "model",
   "strokes": "18/18"
  },
  {
   "obs": "OBS-18",
   "value": "unclear",
   "agree": "0/3",
   "source": "model",
   "strokes": "0/18"
  },
  {
   "obs": "OBS-19",
   "value": "accelerates_through_contact",
   "agree": "2/3",
   "source": "model",
   "strokes": "12/18"
  },
  {
   "obs": "OBS-20",
   "value": "waist_to_chest",
   "agree": "2/3",
   "source": "model",
   "strokes": "12/18"
  },
  {
   "obs": "OBS-21",
   "value": "unclear",
   "agree": "3/3",
   "source": "model",
   "strokes": "18/18"
  },
  {
   "obs": "OBS-22",
   "value": "hinged_back",
   "agree": "2/3",
   "source": "model",
   "strokes": "12/18"
  },
  {
   "obs": "OBS-23",
   "value": "slightly_bent",
   "agree": "3/3",
   "source": "model",
   "strokes": "18/18"
  },
  {
   "obs": "OBS-24",
   "value": "wrist_stable",
   "agree": "3/3",
   "source": "model",
   "strokes": "18/18"
  },
  {
   "obs": "OBS-25",
   "value": "simultaneous",
   "agree": "2/3",
   "source": "model",
   "strokes": "12/18"
  },
  {
   "obs": "OBS-26",
   "value": "shallow_angle",
   "agree": "3/3",
   "source": "model",
   "strokes": "18/18"
  },
  {
   "obs": "OBS-27",
   "value": "fixed_angle",
   "agree": "3/3",
   "source": "model",
   "strokes": "18/18"
  },
  {
   "obs": "OBS-28",
   "value": "perpendicular_vertical",
   "agree": "3/3",
   "source": "model",
   "strokes": "18/18"
  },
  {
   "obs": "OBS-29",
   "value": "lateral_bend_present",
   "agree": "2/3",
   "source": "model",
   "strokes": "12/18"
  },
  {
   "obs": "OBS-30",
   "value": "unclear",
   "agree": "2/3",
   "source": "model",
   "strokes": "12/18"
  },
  {
   "obs": "OBS-31",
   "value": "forward_and_upward",
   "agree": "3/3",
   "source": "model",
   "strokes": "18/18"
  },
  {
   "obs": "OBS-32",
   "value": "rotational_drive",
   "agree": "2/3",
   "source": "model",
   "strokes": "12/18"
  },
  {
   "obs": "OBS-33",
   "value": "more_than_one_forearm_length",
   "agree": "2/3",
   "source": "model",
   "strokes": "12/18"
  },
  {
   "obs": "OBS-34",
   "value": "stays_above_front_foot",
   "agree": "3/3",
   "source": "model",
   "strokes": "18/18"
  },
  {
   "obs": "OBS-35",
   "value": "unclear",
   "agree": "0/3",
   "source": "model",
   "strokes": "0/18"
  },
  {
   "obs": "OBS-36",
   "value": "directly_toward_ball",
   "agree": "3/3",
   "source": "model",
   "strokes": "18/18"
  },
  {
   "obs": "OBS-37",
   "value": "drop_in_loop",
   "agree": "3/3",
   "source": "model",
   "strokes": "18/18"
  },
  {
   "obs": "OBS-38",
   "value": "shoulder_width_or_wider",
   "agree": "3/3",
   "source": "model",
   "strokes": "18/18"
  },
  {
   "obs": "OBS-39",
   "value": "neutral_flat",
   "agree": "3/3",
   "source": "model",
   "strokes": "18/18"
  },
  {
   "obs": "OBS-40",
   "value": "racket_arm_behind_torso_line",
   "agree": "2/3",
   "source": "model",
   "strokes": "12/18"
  },
  {
   "obs": "OBS-41",
   "value": "unclear",
   "agree": "3/3",
   "source": "model",
   "strokes": "18/18"
  }
 ]
}