{
  "clip_id": "1W1rope5l0k_76-106",
  "camera": "B",
  "audio_stripped": true,
  "prompt_version": "facts_v2",
  "model": "gemini-3.8-flash",
  "runs": 3,
  "facts": [
    {
      "obs": "OBS-01",
      "value": "unclear",
      "agree": "0/3",
      "source": "model",
      "strokes": "0/0"
    },
    {
      "obs": "OBS-04",
      "value": "unclear",
      "agree": "0/3",
      "source": "model",
      "strokes": "0/0"
    },
    {
      "obs": "OBS-05",
      "value": "unclear",
      "agree": "0/3",
      "source": "model",
      "strokes": "0/0"
    },
    {
      "obs": "OBS-06",
      "value": "unclear",
      "agree": "0/3",
      "source": "model",
      "strokes": "0/0"
    },
    {
      "obs": "OBS-07",
      "value": "unclear",
      "agree": "0/3",
      "source": "model",
      "strokes": "0/0"
    },
    {
      "obs": "OBS-10",
      "value": "unclear",
      "agree": "0/3",
      "source": "model",
      "strokes": "0/0"
    },
    {
      "obs": "OBS-15",
      "value": "unclear",
      "agree": "0/3",
      "source": "model",
      "strokes": "0/0"
    },
    {
      "obs": "OBS-16",
      "value": "unclear",
      "agree": "0/3",
      "source": "model",
      "strokes": "0/0"
    },
    {
      "obs": "OBS-20",
      "value": "unclear",
      "agree": "0/3",
      "source": "model",
      "strokes": "0/0"
    },
    {
      "obs": "OBS-21",
      "value": "unclear",
      "agree": "0/3",
      "source": "model",
      "strokes": "0/0"
    },
    {
      "obs": "OBS-30",
      "value": "unclear",
      "agree": "0/3",
      "source": "model",
      "strokes": "0/0"
    },
    {
      "obs": "OBS-11",
      "value": "unclear",
      "agree": "0/3",
      "source": "model",
      "strokes": "0/0"
    }
  ]
}