{
  "clip_id": "Psidjei5BnI_108-138",
  "camera": "B",
  "audio_stripped": true,
  "prompt_version": "facts_v2",
  "model": "gemini-3.8-flash",
  "runs": 3,
  "facts": [
    {
      "obs": "OBS-01",
      "value": "clearly_bent",
      "agree": "3/3",
      "source": "model",
      "strokes": "3/3"
    },
    {
      "obs": "OBS-04",
      "value": "pause_present",
      "agree": "2/3",
      "source": "model",
      "strokes": "2/3"
    },
    {
      "obs": "OBS-05",
      "value": "split_step_and_adjust_steps",
      "agree": "3/3",
      "source": "model",
      "strokes": "3/3"
    },
    {
      "obs": "OBS-06",
      "value": "semi_open",
      "agree": "2/3",
      "source": "model",
      "strokes": "2/3"
    },
    {
      "obs": "OBS-07",
      "value": "a:reaches_across_body_front",
      "agree": "3/3",
      "source": "model",
      "strokes": "3/3"
    },
    {
      "obs": "OBS-10",
      "value": "a:heel_up_at_contact",
      "agree": "2/3",
      "source": "model",
      "strokes": "2/3"
    },
    {
      "obs": "OBS-15",
      "value": "a:finish_above_non_hitting_shoulder",
      "agree": "3/3",
      "source": "model",
      "strokes": "3/3"
    },
    {
      "obs": "OBS-16",
      "value": "good",
      "agree": "3/3",
      "source": "model",
      "strokes": "3/3"
    },
    {
      "obs": "OBS-20",
      "value": "waist_to_chest",
      "agree": "3/3",
      "source": "model",
      "strokes": "3/3"
    },
    {
      "obs": "OBS-21",
      "value": "after_contact",
      "agree": "3/3",
      "source": "model",
      "strokes": "3/3"
    },
    {
      "obs": "OBS-30",
      "value": "deep_near_baseline",
      "agree": "3/3",
      "source": "model",
      "strokes": "3/3"
    },
    {
      "obs": "OBS-11",
      "value": "down_then_forward_and_up",
      "agree": "3/3",
      "source": "model",
      "strokes": "3/3"
    }
  ]
}